"認有可趁之機，竟基於行使偽造私文書、使公務員登載不實及意圖供冒用身分使用，而偽造國民身分證之犯意，於民國103年10月16日上午8時50分許。因遺失而須補領國民身分證，並冒用黃淑菁之名義，在該所承辦公務員列印之「補領國民身分證申請書」之申請人欄內，偽造「黃淑菁」之署押1枚，並將其照片1張黏貼於上開申請書上，表示係黃淑菁本人因遺失而申請補領國民身分證之用意，以上開方式偽造「補領國民身分證申請書」1份後，持以向不知情之該所承辦公務員行使。登載於職務上所掌之戶籍登記電磁紀錄準公文書上完竣，並據以補發貼有黃淑玲照片之偽造「黃淑菁」國民身分證（下稱偽造國民身分證）。黃淑玲領得上開偽造國民身分證後，復在上開文件之申請人（受委託人）領證簽章欄內偽造「黃淑菁」之署押1枚，以此方式偽造黃淑菁已領得該國民身分證之證明，足生損害於黃淑菁之權益暨戶政機關對國民身分證登記管理之正確性。二、黃淑玲另基於行使偽造私文書及行使偽造國民身分證之犯意，於103年10月16日下午2時39分許前之某日時，委由真實姓名不詳且不知情之刻印業者（無證據證明其未成年），偽刻「黃淑菁」之印章1顆（下稱印章甲），再於103年10月16日下午2時39分許，攜帶上開偽造之印章甲及國民身分證至址設基隆市○○區○○路0號之基隆中山郵局，冒用黃淑菁之名義填載「郵政存簿/綜合儲金儲戶申請變更帳戶事項申請書（起訴書誤載為印鑑卡）」，接續在戶名（新戶名）欄、儲戶姓名（原戶名）欄內偽造「黃淑菁」之署押各1枚，並在更換印鑑欄、原留印鑑欄內蓋用前揭「黃淑菁」之印文各1枚，表示係黃淑菁本人因遺失印鑑而申請補發其基隆中山郵局帳號00000000000000號帳戶（下稱系爭帳戶）之存摺及更換印鑑、密碼之用意，以上開方式偽造「郵政存簿/綜合儲金儲戶申請變更帳戶事項申請書」1份後，持該申請書及偽造國民身分證向不知情之郵局承辦人員行使之，致郵局承辦人員誤以為係黃淑菁本人申請而補發系爭帳戶之存摺並更換系爭帳戶之印鑑及密碼。三、黃淑玲復意圖為自己不法之所有，基於行使偽造私文書及詐欺取財之犯意，於103年10月17日上午8時54分許，攜帶上開偽造之印章甲至址設基隆市○○區○○○路000○00號之基隆大武崙郵局，冒用黃淑菁之名義填載「郵政存簿儲金提款單」，並在請蓋原留印鑑欄內蓋用前揭「黃淑菁」之印文1枚，表示係黃淑菁本人提領系爭帳戶內之存款新臺幣（下同）9,900元之用意，以上開方式偽造「郵政存簿儲金提款單」1份後，持該提款單向不知情之郵局承辦人員行使之。足生損害於黃淑菁、郵局之權益暨郵局對帳戶管理之正確性（詐欺部分未據黃淑菁告訴）。四、黃淑玲又基於行使偽造私文書及行使偽造國民身分證之犯意，於103年12月4日上午11時55分許前之某日時，委由真實姓名不詳且不知情之刻印業者（無證據證明其未成年），偽刻「黃淑菁」之印章1顆（下稱印章乙），並於103年12月4日上午11時55分許（起訴書誤載為同日上午11時57分許），攜帶上開偽造之印章乙及國民身分證至址設基隆市○○區○○路00號之基隆孝三路郵局，冒用黃淑菁之名義填載「郵局代受理他局存簿儲金變更印鑑掛失補副申請書」、「郵政存簿/綜合儲金儲戶申請變更帳戶事項申請書（起訴書誤載為印鑑卡）」，接續在「郵局代受理他局存簿儲金變更印鑑掛失補副申請書」戶名欄內偽造「黃淑菁」之署押1枚、在出生日期欄、身分證統一編號（統一證號）欄、帳戶印鑑欄內蓋用前揭「黃淑菁」之印文各1枚，並在「郵政存簿/綜合儲金儲戶申請變更帳戶事項申請書」戶名（新戶名）欄、儲戶姓名（原戶名）欄內偽造「黃淑菁」之署押各1枚、在更換印鑑欄、國民身分證正反面影本黏貼處、原留印鑑欄蓋用前揭「黃淑菁」之印文各1枚，表示係黃淑菁本人因遺失印鑑而申請補發系爭帳戶之存摺及更換印鑑、密碼之用意，以上開方式偽造「郵局代受理他局存簿儲金變更印鑑掛失補副申請書」、「郵政存簿/綜合儲金儲戶申請變更帳戶事項申請書」各1份後，持上開2份申請書及偽造國民身分證向不知情之郵局承辦人員行使之，致郵局承辦人員誤以為係黃淑菁本人申請而補發系爭帳戶之存摺並更換系爭帳戶之印鑑及密碼。伊為如事實欄三所示之行為後，已將系爭帳戶之存摺及偽造之印章甲還給黃淑菁云云。惟查：㈠上揭事實欄一至三所示之犯罪事實。且系爭帳戶於103年12月4日上午11時55分許，曾經人冒用黃淑菁之名義，在基隆孝三路郵局辦理申請補發存摺及更換印鑑、密碼，並填載郵局代受理他局存簿儲金變更印鑑掛失補副申請書、郵政存簿/綜合儲金儲戶申請變更帳戶事項申請書各1份，在上開文件上偽簽如附表二編號四所示之黃淑菁署押及蓋用如附表二編號四所示之印章乙之印文等情，業據證人黃淑菁於偵查中證稱：伊未於103年12月4日申請變更系爭帳戶之印鑑及補發系爭帳戶之存摺等語甚明（見偵查卷第52頁、第55頁）。加以依前揭103年12月4日郵政存簿/綜合儲金儲戶申請變更帳戶事項申請書影本所示，該文件上黏貼之國民身分證影本與被告前於103年10月16日申請補發之偽造國民身分證實屬同一，被告復就如附表二編號四所示之「黃淑菁」署押為其所偽簽、其上黏貼之國民身分證正面影本照片為其本人等節，均坦承如前。應予依法論科。二、論罪科刑：㈠刑法第214條所謂使公務員登載不實事項於公文書罪，須一經他人之聲明或申報。㈡核被告如事實欄一所為，係犯刑法第216條、第210條之行使偽造私文書罪、同法第214條之使公務員登載不實罪及戶籍法第75條第1項之偽造國民身分證罪；如事實欄二所為，係犯刑法第216條、第210條之行使偽造私文書罪及戶籍法第75條第2項、第1項之行使偽造國民身分證罪；如事實欄三所為，係犯刑法第216條、第210條之行使偽造私文書罪及同法第339條第1項之詐欺取財罪；如事實欄四所為，係犯刑法第216條、第210條之行使偽造私文書罪及戶籍法第75條第2項、第1項之行使偽造國民身分證罪。起訴意旨認上開事實欄一、二、四所示犯行，係構成刑法第210條之行使偽造私文書罪，上開事實欄三所示犯行，係構成刑法第210條之行使偽造私文書罪及同法第339條第1項之詐欺取財罪，尚有未合。依罪疑唯輕之法則，爰認定係成年人）偽造印章甲、乙，並利用不知情之基隆市中山區戶政事務所承辦公務員偽造國民身分證，均應論以間接正犯。㈣被告偽刻印章甲、乙後，持以偽造如附表二編號二至四所示之印文，暨其偽造如附表二編號一至四所示署押等行為，均為偽造如附表二所示私文書之部分行為；而其偽造如附表二所示之私文書後持以行使，偽造私文書之低度行為，為行使私文書之高度行為所吸收。㈤被告如事實欄一至四所為，各係以一個遞交如附表二所示偽造私文書之行為觸犯上開數罪名，為想像競合犯，皆應依刑法第55條之規定，從一重之行使偽造私文書罪處斷。㈥被告所犯上開行使偽造私文書罪（共4罪），犯意各別。先予敘明。㈡行為人用以詐欺取財之偽造書類，既已交付於被害人收受，則該物非屬行為人所有，除偽造書類上偽造之印文、署押，應依刑法第219條予以沒收外，即不得再對各該書類諭知沒收（最高法院43年台上字第747號判例要旨參照）。查如附表二所示之偽造私文書，均由被告交由基隆市中山區戶政事務所、基隆中山郵局、基隆大武崙郵局、基隆孝三路郵局收執。自無庸宣告沒收。惟未扣案之其上如附表二所示之偽造印文、署押，及未扣案之上開偽造之印章甲、乙，均應依刑法第219條之規定。",0.67,0,偽造文書
"侵占拾得他人財物，復持侵占之信用卡盜刷消費，破壞金融正常交易秩序，盜刷金額僅新臺幣（以下同）1,200元，所生危害非鉅。追徵其價額。㈡另未據扣案被告偽造之簽帳單上「姜維倫」署押1枚，係出於被告之偽造，不問屬於犯人與否，應依刑法第219條之規定宣告沒收。㈢另被告所偽造之「姜維倫」信用卡簽帳單1張，業已交付於飯店櫃台人員。",0.25,5000,偽造文書
"事實及理由一、本件犯罪事實及證據，除犯罪事實欄一第4行「變造」之記載，應更正為「偽造」、第5行「某網咖」記載後補充「冒充HANAMARU公司之名義」、第6行「不實價格」記載後補充「（原價格為日幣28萬4,400元）」、第8至9行「足生損害於稅務機關查核關稅之正確性」之記載，補充為「足以生損害於HANAMARU公司及財政部關務署基隆關對進口報關文件審核與核課稅額之正確性」外。二、論罪科刑㈠核被告呂自凱所為，係犯刑法第216條、第210條之行使偽造私文書罪。被告偽簽「KAZUYAOKAZAKI」署名之行為，係偽造私文書之部分行為，偽造私文書後復持以行使，其偽造之低度行為已為行使偽造私文書之高度行為所吸收，均不另論罪。審酌被告貪圖節省稅賦支出，竟冒用HANAMARU公司之名義，偽造報關發票並利用不知情之報關人員，持向財政部關務署基隆關報運貨物進口。以資儆懲。㈢偽造之印章、印文或署押，不問屬於犯人與否。刑法第219條定有明文。查被告所行使之如附表所示之偽造私文書，因已交付於財政部關務署基隆關。爰不宣告沒收。然其上偽造之「KAZUYAOKAZAKI」署名1枚，不問屬於犯人與否。",0.17,0,偽造文書
核被告此部分所為，係犯刑法第216條、第210條、第220條第2項之行使偽造準私文書罪。其偽造準私文書之行為，應為行使偽造準私文書之高度行為所吸收，不另論罪。又依卷附台灣高等法院被告前案紀錄表之記載，被告曾因侵占、偽造文書罪，經最高法院以94年度台上字第3527號判決有期徒刑8月、4月。故意為本件有期徒刑以上之犯罪，為累犯，均應依刑法第47條第1項規定加重其刑。㈡科刑部分：爰以行為人之責任為基礎。被告為取信劉女，竟以行使偽造私文書之方式為之，損害中華電信股份有限公司之文書信用。難認有悔意，並參酌其素行、生活狀況、智識程度、成立累犯等一切情狀，爰分別量處如主文所示之刑。查，被告偽造之中華電信北區分公司電磁記錄，屬被告犯罪所生及供犯罪所用之物。,0.58,0,偽造文書
揆諸前揭說明，所為自屬變造私文書之行為無疑。故核被告所為，均係犯刑法第216條、第210條之行使變造私文書罪、同法第339條第2項之詐欺得利罪（各2罪）。聲請簡易判決處刑書犯罪事實欄業已敘及詐欺得利之犯罪事實，惟漏載前揭詐欺得利罪名，應予補充。被告變造私文書之低度行為，各為其行使變造私文書之高度行為所吸收，均不另論罪。均有犯意聯絡及行為分擔，皆應論以共同正犯。被告前揭犯行。皆構成間接正犯。被告所犯前揭各次行使變造私文書罪及詐欺得利罪，均係以一報關之行使行為觸犯上開罪名。皆應依刑法第55條之規定，從一重之行使變造私文書罪處斷。被告所犯上開行使變造私文書罪（共2罪），犯意各別。以示懲儆。三、被告變造之發票2紙，業經被告行使而交付予財政部關務署基隆關（下稱基隆關）收受。,0.33,0,偽造文書
㈡基隆市警察局第二分局偵辦毒品案件尿液檢體對照表。二、論罪科刑及沒收：㈠按刑法第217條所稱之偽造署押，係指行為人冒用本人名義在文件或物體上偽造簽名或為民法第3條第3項所稱指印之類似簽名之行為者而言；倘行為人書寫他人之姓名。縱未經該他人授權書寫，仍不生偽造署押之問題，該填載亦不得依刑法第219條諭知沒收。則係犯偽造文書罪（最高法院85年度臺非字第146號、80年度臺非字第277號判決意旨參照）。是以在文件或物品上偽簽他人之署押，究係構成偽造文書或偽造署押，應從該文件或物品於簽署後所整體表彰之意涵觀之，倘簽署後之文件或物品足以彰顯簽署人欲對外表示一定之法效意思時，即屬偽造文書，惟若簽署人簽署之原意僅在被動收受他人之意思。再無任何其他用意，則屬偽造署押，又倘簽署人簽署之他人姓名僅單純作為識別使用。已具備私文書之性質。是以被告冒用「吳俊緯」之名義，在上開文書上簽名、按捺指印。並持交警察機關收執附卷而行使之，自屬行使偽造私文書。2.如附表編號1.2.3.所示之各文件。如上述說明，即屬偽造署押。㈡核被告所為，係犯刑法第216條、第210條行使偽造私文書罪。被告於如附表編號4.所示之私文書上偽造「吳俊緯」署押之行為，均係偽造上開私文書之階段行為，其偽造私文書後進而行使，偽造之低度行為均為行使之高度行為所吸收，均不另論罪。又被告經警逮捕後，即冒名配合員警進行調查程序，並於如附表編號1.2.3.所示之文書上偽造「吳俊緯」署押之行為，主觀上當然有自始至終在同一刑事案件各階段中偽造私文書及署押之意思，是被告如附表所示偽造私文書、偽造署押之數舉動，不過為犯罪行為之一部。㈢爰審酌被告為求掩飾身分規避警方逮捕，竟假冒被害人吳俊緯身分應訊，並在如附表所示文件上偽簽「吳俊緯」之簽名及指印以矇騙承辦警員及偵查機關，妨害警察及偵查機關對於偵查犯罪處罰之正確性。修正後刑法第38條第2項定有明文。又刑法第219條規定：偽造之印文或署押，不問屬於犯人與否。係採義務沒收主義，凡偽造之印文或署押，不論是否屬於犯人所有。均應依法宣告沒收（最高法院94年度台上字第3518號判決佐憑）。被告於附表所示之各項文件上偽造之「吳俊緯」署押共計13枚（簽名6枚、指印7枚），均係被告偽造之署押，皆應依同法第219條規定。,0.25,0,偽造文書
為隱匿其真實身分，竟本於冒用「鄭進益」姓名、年籍資料接受調查之同一目的，而基於偽造署押及行使偽造私文書之單一接續犯意，自上開被逮捕之時起。分別在新北市政府警察局土城分局清水派出所及新北地方法院檢察署，假冒「鄭進益」之名義，接續在附表所示之文件上偽造「鄭進益」之簽名及指印，進而偽造如附表編號⒊⒍⒎所示足以表彰「鄭進益」自願同意接受搜索、已收受拘捕通知、知悉受拘捕原因及遭拘捕不用通知親屬之文書，並在簽署完成後接續交付承辦員警、檢察官收執存卷而行使之，均足以生損害於「鄭進益」本人、警察機關及檢察官對刑事犯罪偵查之正確性。嗣因新北市政府警察局土城分局員警將陳漢彬冒名所按捺之指紋卡送請內政部警政署刑事警察局進行指紋比對，發現與該局檔存陳漢彬之指紋相符。應依法論科。二、論罪科刑：㈠按刑法第217條所稱之「偽造署押」，係指行為人冒用本人名義在文件上簽名或為民法第3條第3項所稱指印之類似簽名行為（最高法院80年度台非字第277號判決意旨參照），故倘行為人以簽名之意。自非被告所製作之私文書，僅應論以偽造署押罪。且警方以「通知」之文件踐行刑事訴訟法第95條等所定告知程序時，被告於該「通知」之「被調查詢問人」欄下偽簽姓名者，該「通知」實質上與詢問筆錄無異，並未表示另外製作何種文書，故論以偽造署押罪（最高法院91年度台非字第294號判決意旨參照）。又人民被逮捕拘禁時。應具有私文書之性質。㈡查被告在如附表編號⒊⒍⒎所示文書上偽造「鄭進益」之簽名及指印，已足以分別表示係「鄭進益」本人自願同意接受搜索、已收受拘捕通知、知悉受拘捕原因及遭拘捕不用通知親屬等用意證明。被告並無製作之權；另附表編號⒈所示文書上被告所偽造之「鄭進益」簽名、指印則係被告為掩飾身份之用，該等署押僅作為人格同一性之證明。自均不具文書之性質，此部分應僅單純構成偽造署押罪。是核被告所為，係犯刑法第216條、第210條之行使偽造私文書罪。被告先後於附表所示之文書上偽造「鄭進益」之署名及指印、先後偽造如附表編號⒊⒍⒎所示之私文書並持以行使之行為，均係於密切接近之時、地實施。且各行為間之獨立性極為薄弱，主觀上當有自始至終於該案件各階段進行過程接續冒名「鄭進益」之意，均屬接續犯，各應分別論以接續犯。再被告上開接續偽造署押之犯行為偽造私文書之部分行為，其偽造私文書之低度行為復為行使偽造私文書之高度行為所吸收，皆不另論罪。故意再犯本件有期徒刑以上之罪，為累犯，應依刑法第47條第1項規定加重其刑。㈣本院審酌被告為逃避刑責，竟冒用鄭進益之名義應詢，影響司法機關辨識被告身分之正確性。應一律適用新法之相關規定。查被告在如附表所示各文件上偽造之「鄭進益」署名及指印，均係偽造之署押，應依刑法第219條規定。,0.33,0,偽造文書
詎鍾明鴻為逃避刑責，竟基於偽造署押、行使偽造私文書之接續犯意，先後於同日6時35分起。接續在如附表所示文件上，偽造如附表所示數量之「顏國茂」署名（詳如附表所示）並持以交付承辦員警及司法機關收執存卷，表示顏國茂表明收受通知之意，足生損害於顏國茂及司法機關偵辦刑事案件之正確性。嗣經高雄市政府警察局新興分局員警將鍾明鴻冒用「顏國茂」名義於上述詢問過程所按捺之指紋卡片，送請內政部警政署刑事警察局鑑驗。業據被告鍾明鴻於本院審理中坦承不諱（見本院卷第60、63、65頁），並有內政部警政署101年1月30日刑紋字第1010010634號函暨檢附被告冒用「顏國茂」名義採取之指紋卡片影本1份與檔存被告之指紋卡片影本各1份（見高雄市政府警察局新興分局高市警新分偵字第1017002895號卷【下稱警一卷】第1、3-4頁），且有被告冒名顏國茂所為如附表所示之文件（證據出處，詳如附表所示）在卷可稽。應依法論科。二、論罪科刑：㈠刑法第217條所稱之「偽造署押」，係指行為人冒用本人名義在文件上簽名或為民法第3條第3項所稱指印之類似簽名之行為者而言（最高法院80年度臺非字第277號判決意旨可參）。故倘行為人係以簽名或蓋印之意。從而，被告在偵訊筆錄上偽造署押，並未表示另外製作何種文書，應只論以偽造署押罪，不另論行使偽造私文書罪（最高法院91年度臺非字第294號判決意旨參照）。另偵查機關所製作之逮捕通知書、權利告知書。即足表示由該姓名之人收受此項通知書、告知書之證明，若有冒名而為之者，即應成立偽造私文書罪；惟倘係於「被通知（告知）人簽章」欄簽名及捺指印時。尚不能表示其係有製作何種文書之意思及曾為何項之意思表示，故若有冒名而為之者，應認成立偽造署押罪。查被告在如附表編號1、6、7所示文件欄位等處，偽簽「顏國茂」之署名及按捺指印、掌紋，僅係表明被訊問人別或見證公務人員製作文件作業過程無訛。上開文件製作權人仍係員警或公務人員，應認均僅係單純偽造署押，與偽造私文書無涉。而如附表編號2、3所示之被告權利告知書、執行拘提逮捕告知本人通知書，係由被告於「被告知人」、「被通知人簽名捺印」等欄位，冒簽他人姓名，揆諸上開說明。尚無製作何種文書之意思及曾為何項之意思表示，應認均僅係單純偽造署押。另被告在如附表編號4、5所示之「新興分局前金分駐所執行拘提逮捕告知親友通知書」、「夜間詢問同意書」等文件上，分別偽簽「顏國茂」之署名並按捺指印，乃分別表示顏國茂本人同意警方對其實施夜間詢問及警方不用通知其親友之意思。足認被告有將該文件內容採為自己一定意思表示之意，其所為應屬刑法第210條規定之偽造私文書甚明。㈡核被告所為，係犯刑法第216條、第210條之行使偽造私文書罪，同法第217條第1項之偽造署押罪。原起訴書誤認為僅涉犯偽造署押罪，容有誤會。附此敘明（最高法院96年度台上字第6512號判決要旨參照）。被告於如附表編號4、5號之文書上偽造署押係該偽造私文書之部分行為，其偽造私文書之低度行為復為行使之高度行為所吸收，均不另論罪。又被告先後於如附表所示文件上偽造署押、行使偽造私文書之行為，係因同一事件。而僅論以一罪。而被告以一冒名應訊之行為，觸犯前開偽造署押及行使偽造私文書之行為，為想像競合犯，應依刑法第55條從一重論以行使偽造私文書罪。㈢以行為人為基礎，審酌被告意圖逃避刑責，竟冒用「顏國茂」之名義應訊，足使被冒名之人即顏國茂因上開案件被傳、拘或追訴之虞，並影響司法機關偵辦刑事案件之進行。並諭知易科罰金之折算標準。㈣如附表所示之偽造「顏國茂」之署名共11枚、指印30枚及掌紋2枚，不問屬於被告與否。,0.25,0,偽造文書
