意圖為自己不法所有，基於業務侵占及行使變造私文書、行使業務登載不實文書之犯意，於104年8月3日至104年9月1日之間某日。將其基於業務上之機會而持有之斡旋金50萬元，擅自挪用以清償其個人債務而予侵占，又為免事跡敗露。用以表示斡旋金數額由50萬元更正為5萬元，且係由其本人塗改之意思而變造私文書，另以在乙委託書手寫註記「作廢」字樣之方式。均足生損害於盧信樺及巨峰公司對斡旋金稽核之正確性，俟登載不實及變造完成後，旋於同日，在上址巨峰公司內，將甲委託書（業務上登載不實之文書）及乙委託書（變造之私文書），一併呈交給巨峰公司會計人員稽核而行使之。竟另意圖為自己不法所有，基於詐欺取財之犯意，商請盧信樺加價購買上開房地。又張東森明知上開房地已於104年10月4日出售予他人，仍承前詐欺取財之犯意，於104年10月8日某時。需先支付仲介服務費10萬元云云，使盧信樺因而陷於錯誤，再當場交付現金10萬元予張東森。並有內容不實之「巨峰公司104年7月25日編號M696733號買賣議價委託書」1份（即甲委託書，見警卷第9頁）、被告變造之巨峰公司104年8月3日編號M696728號買賣議價委託書1份（即乙委託書，見警卷第12頁）、巨峰公司104年9月1日編號V743711號委託銷售/出租契約內容變更同意書影本1份（見警卷第15頁）、人事資料卡影本1紙（見警卷第17頁）、104年10月8日估價單（即收據）影本1紙（見偵卷第21頁）在卷可稽。自無論罪之餘地；刑法第210條之偽造私文書罪，以無製作權人而捏造他人名義製作該文書為構成要件。除有特別規定外，原不構成偽造、變造文書之罪，惟於自己之賬簿所記物品數額。如就數額加以變更，即應認為變造文書，若於所記數額外。而與他人承認之數額無關者，仍不得謂構成變造文書罪，最高法院20年非字第76號判例、86年臺上字第3158號判決、25年上字第4862號判例意旨可資參照。故被告事後再將經證人盧信樺確認後之金額予以擅加塗改，即應認係變造私文書。從而，核被告就犯罪事實一所為，係犯刑法第336條第2項業務侵占、同法第216條、第215條行使業務登載不實文書、同法第216條、第210條行使變造私文書等罪。被告於犯罪事實一中之業務文書登載不實及變造私文書等低度行為，均為行使之高度行為吸收。至公訴意旨認被告在甲委託書上加註「作廢」字樣後持以行使，係犯同法第216條、第210條行使變造私文書罪嫌。但被告此部分並未針對甲委託書之原有內容予以變更。而行使其業務上所作成之不實文書，自應構成刑法第216條、第215條行使業務登載不實文書罪。公訴意旨此部分所認。變更起訴法條並為審理。另被告變造乙委託書後，雖復於其上登載「作廢」之不實內容，然因乙委託書之原有內容已遭改變而屬虛偽不實，則其登載不實部分即應包含在被告對原有內容的改變之中，亦不另論罪。復核被告就犯罪事實二所為，係犯刑法第339條第1項詐欺取財罪。公訴意旨固認被告於104年9月1日、104年10月8日向證人盧信樺收取現金20萬元、10萬元，亦係犯刑法第336條第2項業務侵占罪嫌。惟查。藉口再要求證人盧信樺給付現金10萬元，其所為顯係以捏造虛偽之事，假借名義要求證人盧信樺交付財物。是被告於104年9月1日、104年10月8日向證人盧信樺收取現金20萬元、10萬元，應認均屬對證人盧信樺施用詐術，使證人盧信樺陷於錯誤交付財物，構成刑法第339條第1項詐欺取財罪。公訴意旨上開所認。係於同一時間、地點，將業務上登載不實之文書（即甲委託書）及變造之私文書（即乙委託書），一併呈交給巨峰公司會計人員稽核而行使之。應依刑法第55條規定，從一重之行使變造私文書罪處斷。再者，被告本件於犯罪事實一中，先為業務侵占，嗣為免事跡敗露，始鋌而走險而行使變造私文書，其各次犯行中之數個行為間。故依刑法第55條規定，從一重之業務侵占罪處斷。此外，被告於犯罪事實二中先後2次詐欺取財之行為，係於密切接近之時間實行。透過為客戶處理不動產買賣議價、收款之業務上機會，將業務上所收取之斡旋金款項50萬元挪為己用而予侵占，復為掩飾其業務侵占犯行，率爾製作內容不實之甲委託書及變造乙委託書，呈交稽核。而被告本件未經深思熟慮，率爾將業務上持有之款項予以侵占、詐取他人財物，致罹刑章。不予宣告沒收或追徵。至被告於如犯罪事實一中所為業務登載不實之文書（即甲委託書）及變造之私文書（即乙委託書），因已呈交給告訴人巨峰公司。被告持以取信於證人盧信樺之巨峰公司104年9月1日編號V743711號委託銷售/出租契約內容變更同意書1份、收據1紙，雖均為供被告犯詐欺取財罪所用之物，但均未扣案。,1.0,0,偽造文書
欠缺對人、事、時之認識能力，基於共同行使偽造私文書及使公務員登載不實之犯意聯絡，先於同年12月4日前某時許。擅以陳春枝所取得之陳黃金蘭印章，在附表編號1委託書之委託人欄上盜蓋「陳黃金蘭」之印文1枚，以此方式偽造該委託書後，陳秋菊、陳春枝再於同年12月4日，共同前往高雄市鳳山第二戶政事務所（下稱鳳山第二戶政事務所），接續在附表編號2印鑑證明申請書之申請人欄上盜蓋「陳黃金蘭」之印文1枚，以此方式偽造該申請書，偽以表示其獲有陳黃金蘭授權而代理申請發給陳黃金蘭印鑑證明之意。誤信陳春枝獲有授權而核發陳黃金蘭之印鑑證明予其收執。陳秋菊、陳春枝復於同日接續盜蓋「陳黃金蘭」之印文在附表編號3至4之土地建築改良物買賣所有權移轉契約書（下稱買賣契約書）及土地登記申請書，以此方式偽造各該私文書（盜蓋印文之數量及其欄位，詳如附表編號3至4所示）。三、核被告陳秋菊、陳春枝所為，均係犯刑法第216條、第210條行使偽造私文書罪、同法第214條之使公務員登載不實文書罪。被告2人就上開犯行具有犯意聯絡及行為分擔。為間接正犯。被告2人盜用陳黃金蘭印章而蓋用印文之行為，為其偽造私文書之部分行為，而其偽造私文書之低度行為，復為其行使偽造私文書之高度行為所吸收，均不另論罪。被告同時偽造如附表所示之文書，並進而同時行使之，其偽造私文書之行為，係為達同一前揭房地所有權移轉登記目的而為之各個舉動。為接續犯，應論以一行使偽造私文書罪。又被告於103年12月18日，向地政機關辦理不動產移轉登記，係一行為觸犯行使偽造私文書罪及使公務員登載不實文書罪，為想像競合犯，應依刑法第55條規定，從一重之行使偽造私文書罪處斷，四、爰審酌被告2人明知其母親陳黃金蘭與預立遺囑將本件房地留由被告2人共同繼承。欠缺對人、事、時之認識能力，率然盜用陳黃金蘭之印章而蓋用印文於附表所示文書，以便在陳黃金蘭死亡前移轉本件房地所有權。經法院科刑之紀錄，惟不構成累犯，素行尚可。五、如附表所示文書上之「陳黃金蘭」印文共13枚，均係被告2人盜用其母親陳黃金蘭真正印章所蓋之印文，並非偽造印章之印文，不在刑法第219條所定必須沒收之列（最高法院48年台上字第113號判例參照）。應屬誤會。至被告2人所偽造如附表所示之文書原本，既已分別交付予鳳山第二戶政事務所、鳳山地政事務所而行使。,0.17,0,偽造文書
以新臺幣壹仟元折算壹日。偽造之民國九十七年四月八日不動產買賣契約書上偽造之「李吳阿雀」署名壹枚、印文肆枚，均沒收之。事實一、陳國彬與張家祥、林倉佑（張家祥、林倉佑此部分共同犯使公務員登載不實罪及行使偽造私文書罪部分，業經本院於民國100年9月28日以99年度訴字第1763號、臺灣高等法院高雄分院於101年2月14日以100年度上訴字第1804號、最高法院於101年5月24日以101年台上字第2595號判決有罪確定在案）等3人，均明知林倉佑與李吳阿雀間並無實際之不動產買賣關係，竟為圖謀以虛增房地買賣金額以向金融機構超額貸款，而共同基於使公務員登載不實及行使偽造私文書之犯意聯絡，推由張家祥於97年4月3日先以不知情之友人曾銘坤名義。以不詳方法，偽造「李吳阿雀」之印文4枚及署押1枚，進而偽造內容為「出賣人：『李吳阿雀』、承買人：『林倉佑』，標的為系爭房地。仍足生損害於李吳阿雀及影響臺灣企銀徵信之正確性。二、另陳國彬與張家祥、林倉佑（張家祥、林倉佑此部分另犯使公務員登載不實罪部分，各經上開判決確定在案）、黃捷羚（原名黃淑美，業經本院以104年度簡字第5453號判決有期徒刑2月確定在案），另基於共同使公務員登載不實之犯意聯絡，明知林倉佑與黃捷羚間並無實際之系爭房地買賣關係。臺灣高等法院高雄分院100年度上訴字第1804號卷【下稱院三卷】第51頁至第53頁），復有臺灣企銀房屋貸款契約及系爭偽造之不動產買賣契約書、97年4月3日之不動產買賣契約書、委託登記持名證明書、系爭房地之土地、建物所有權狀影本、土地登記第一類謄本、合作金庫銀行借款契約、消費者貸款契約書及系爭房地之之買賣契約書各1份、本院99年度審訴字第3802號、99年度訴字第1763號、臺灣高等法院高雄分院100年度上訴字第1804號、最高法院101年台上字第2595號卷宗、104年簡字第5453號刑事判決書各1份在卷可稽（見他字卷第3頁至第7頁、第42頁至第46頁、第48頁、第87頁至第91頁、第100頁至第107頁，105年度偵緝字第748號卷【下稱偵三卷】第48頁至第56頁。堪予採信。㈡至被告固曾於本院準備程序中否認系爭偽造之不動產買賣契約書係其所偽造（本院卷第19頁），然本件被告為上開辯詞後。此有本院105年9月22日準備程序筆錄、審判程序筆錄各1份在卷可稽（本院卷第19頁、第28頁），足見被告已坦承上開契約書係其所偽造，況系爭偽造之不動產買賣契約書業經臺灣高等法院高雄分院100年度上訴字第1804號判決，認定均係被告所偽造無訛，此亦有前開臺灣高等法院高雄分院判決書1份在卷足憑（偵三卷第48頁背面），是系爭偽造之不動產買賣契約書確係被告所偽造無訛，併此敘明。三、論罪科刑㈠核被告如事實欄所為，係犯刑法第214條之使公務員登載不實罪、同法第216條、第210條之行使偽造私文書罪；如事實欄所為，則係犯同法第214條之使公務員登載不實罪。次按共同正犯之成立，祇須具有犯意之聯絡。俱為間接正犯。又被告於事實欄中偽造「李吳阿雀」印文4枚、署名1枚之行為（詳後述），係偽造系爭偽造之不動產買賣契約書之階段行為，而偽造私文書復為其後行使之高度行為所吸收，均不另論罪。另被告如事實欄所示之使公務員登載不實及行使偽造私文書之行為，其自然意義上非完全一致。自應依想像競合犯之規定，從重論以行使偽造私文書罪。又被告如事實欄所犯之行使偽造私文書罪及事實欄所犯之使公務員登載不實文書罪間，犯意各別。㈡另按法院之量刑應以被告之罪責為基礎，審酌被告偽造「李吳阿雀」之印文4枚及署名1枚，進而偽造系爭房地之不動產買賣契約書持以行使，而使地政機關公務員登載於職務上所掌之公文書。以資懲儆。四、沒收部分㈠系爭偽造之不動產買賣契約書正本（影本詳見他卷第100至101頁），業經由共犯張家祥交予共犯林倉佑。爰不予宣告沒收。惟該不動產買賣契約書上偽造之「李吳阿雀」印文4枚（其中3枚蓋印於契約條文中、1枚蓋印於契約之末段出賣人欄，又上開3枚蓋印於契約條文中之印文。則不生署押之問題（最高法院95年度台上字第636號判決參照）。本件偽造之97年4月8日不動產買賣契約書上首行賣方欄，雖書寫「李吳阿雀」之名（他卷第100頁）。,0.58,0,偽造文書
"另由檢察官偵辦中）共同意圖為自己不法所有，基於偽造私文書後復持以行使及詐欺取財、竊盜之犯意聯絡，於104年1月8日9時20分前某時許。楊志豐、沈國榮旋上前徒手開啟伍張蔭之機車置物箱，竊取伍張蔭所申請開立之三民路郵局帳號00000000000000號帳戶存摺1本（下稱前開存摺）及印鑑章1顆（下稱前開印章），得手後即共同騎乘前開機車離去。於郵政存簿儲金提款單（下稱前開提款單）上填寫提款金額新臺幣（下同）「參萬伍仟元」，並盜用前開印章蓋用「伍張蔭」印文1枚於前開提款單上，再持前開存摺及提款單向不知情之郵局職員許開昌行使，致該職員陷於錯誤，而如數交附35,000元現款。三、論罪科刑：（一）核被告楊志豐所為，係犯刑法第320條竊盜罪、同法第216、210條之行使偽造私文書罪及同法第339條第1項之詐欺取財罪。按金融機構為便利存款人取款。自屬刑法第210條規定所稱之私文書（最高法院49年度台上字第1409號判例意旨參照）。又被告楊志豐在前開提款單之「請蓋原留印鑑」欄盜蓋告訴人之印章，係用以偽造該提款單，盜用印章之行為為偽造提款單之部分行為；另偽造提款單之低度行為，為行使之高度行為所吸收。（二）被告楊志豐與沈國榮彼此已知悉所從事之行為係整體詐騙行為分工之一環，各為窺見密碼、竊取存摺及印鑑章、提款等任務，顯有就各該犯行相互為利用之意思甚明。（三）被告楊志豐與沈國榮為達詐領被害人存款之目的，依計畫彼此分工為窺見密碼、盜用印章、竊取存摺、駕駛車輛、提款等任務，是被告楊志豐等上開各部分犯行間雖在自然意義上非完全一致。方屬適當（最高法院101年度臺上字第5138號判決意旨參照）。故認被告楊志豐所犯之竊盜罪、行使偽造私文書罪及詐欺取財罪間，係一行為而觸犯數罪名之想像競合犯，應依刑法第55條之規定，從一重以行使偽造私文書罪處斷。檢察官認應予分論併罰。5年以內故意再犯本件有期徒刑以上之罪，為累犯，應依刑法第47條第1項之規定。（五）爰以行為人之責任為基礎，審酌被告楊志豐另有侵占、詐欺、偽造文書、竊盜、公共危險等多項前科（構成累犯部分，不重複評價）。而與沈國榮共同為本件犯行，盜領現金35,000元，侵害告訴人財產法益。自應宣告沒收其盜領所分得現金17,500元，於全部或一部不能沒收時（本案盜領所得現金，並無不宜執行沒收之情形）。自毋庸記載追徵其價額）。另被告楊志豐係以告訴人之印鑑章蓋於偽造提款單上，因該印鑑章屬於他人所有，且印文並非偽造，本不在沒收之列。至於被告楊志豐偽造之前開提款單因已交予鎮北郵局職員收執，非屬被告楊志豐所有。",0.75,0,偽造文書
竟意圖為自己不法之所有，基於詐欺取財、行使偽造私文書之犯意，且未經王文騫、王營行、王玉環及王俊滿等人之同意（均未提出告訴），擅自冒全體繼承人之名義，於某不詳日期委由不知情之刻印業者偽刻「王文騫」、「王營行」、「王玉環」及「王俊滿」等人之印章，並持該等印章。以全體繼承人之名義辦理該王媽福帳戶（帳號00000000000000）之「繼承終止」事宜，並在郵政儲金戶繼承存款申請書（下稱上開存款申請書）上「全體繼承人或遺產管理人」欄上盜蓋「王文騫」、「王營行」、「王玉環」、「王俊滿」印文共4枚，而作成表彰係由全體繼承人授權王俊壽辦理「繼承終止」之不實私文書，繼而持向該郵局職員辦理臨櫃提款加以行使。三、核被告所為，係犯刑法第216條、第210條之行使偽造私文書罪、第339條第1項之詐欺取財罪。被告委託不知情之刻印業者偽刻王文騫、王營行、王玉環、王俊滿印章之行為，及於上開存款申請書上盜蓋王文騫、王營行、王玉環、王俊滿印文之行為，均係偽造私文書之階段行為，應為偽造私文書行為所吸收，又偽造私文書之低度行為，復為嗣後行使之高度行為所吸收。被告以一盜領存款之行為，觸犯上開行使偽造私文書罪、詐欺取財罪2罪名，為想像競合犯，應從一重之行使偽造私文書罪處斷。聲請書意旨認為本案被告係犯意各別、行為互殊。竟貪圖不法利益，冒用全體繼承人之名義，偽刻王文騫、王營行、王玉環及王俊滿等人之印章，並持該等印章，偽造上開存款申請書，盜領王媽福之鳳山區五甲郵局帳戶內款項共16萬2610元，其犯罪之動機、手段、目的均非可取。刑法第2條第2項、刑法施行法第10條之3第1項分別定有明文。查被告於某不詳日期委由不知情之刻印業者偽刻「王文騫」、「王營行」、「王玉環」及「王俊滿」印章4枚及其於鳳山五甲郵局99年1月28日，在上開存款申請書上「全體繼承人或遺產管理人」欄上盜蓋「王文騫、王營行、王玉環、王俊滿」印文4枚，係被告偽造之印章及印章之印文，刑法第219條規定仍係修正後刑法第38條第2項前段之特別規定，既係被告王俊壽偽造之印章、印文，雖未據扣案。,0.25,0,偽造文書
所涉偽造文書罪嫌，另經臺灣高雄地方法院檢察署檢察官為不起訴處分）彼此間並無結婚之真意，僅係藉由假結婚方式，使李純秀得以大陸籍配偶來臺探親之名義，非法進入臺灣地區，藉此謀取不法利益。詎陳財福、劉永富（已歿。經檢察官另為不起訴處分）於93年12月27日前某日，共同基於意圖營利使大陸地區人民非法進入臺灣地區之犯意聯絡；並與欠缺結婚真意之李純秀共同基於使公務員登載不實文書之犯意聯絡，劉永富與陳財福約定由劉永富以招待陳財福於大陸地區之食宿，仲介並安排陳財福充當人頭配偶，由陳財福與李純秀於民國93年12月27日前往大陸地區河南省信陽市公證處辦理登記結婚，取得「結婚公證書」（2004信証民字第951號）等文件後。使李純秀得以合法探親名義為掩飾，於94年4月10日搭機非法入境臺灣地區。嗣於94年8月23日，陳財福與李純秀共同基於使公務員登載不實文書之犯意聯絡，持上開經認證之結婚證書及結婚登記書。茲說明如下：（一）刑法第28條部分：觀諸修正前後刑法第28條之規定，雖對於共同正犯之可罰性有所修正，而屬犯罪後法律有變更。無論依修正前後之規定，均成立共同正犯，適用新法並無較有利於被告。戶籍機關當僅有形式審查權而無實質審查權，是明知無結婚之實，卻使戶政機關之公務員為結婚之登記，自構成刑法第214條之明知不實事項使公務員登載不實罪。查被告使高雄縣甲仙鄉戶政事務所承辦公務員，於戶籍登記簿電腦檔案等公文書上登載不實之行為，核其所為，係犯刑法第214條使公務員登載不實罪。被告與李純秀間。本院爰以行為人之責任為基礎，審酌被告以假結婚之方式，使大陸地區女子非法進入臺灣地區並為不實之結婚登記。,0.12,0,偽造文書
另行租用保管箱存放，竟與奚○怡共同基於行使偽造文書之犯意聯絡，於97年2月29日起至97年3月11日間某時，先推由奚靜山在如附表編號1所示臺灣銀行「保管箱退租申請書」上「承租人」欄位及附表編號2所示「委託書」之「委託人」之欄位，分別偽造「楊○」之簽名各1枚，再由奚○怡盜用「楊○」之印章於上開欄位各蓋用印文1枚，以表彰奚楊○委由奚靜山終止租用上開保管箱契約意旨。二人再於97年3月11日一同前往址設高雄市○○區○○○路00號之臺灣銀行左營分行，將上開偽造之「保管箱退租申請書」、「委託書」交予不知情之臺灣銀行左營分行承辦人員吳秀○而行使，辦理將奚楊○生前租用之上開保管箱1個退租。另由奚靜山向臺灣銀行左營分行租用第Ａ類第0000號保管箱1個，以存放自奚楊○之上開保管箱內所取出之物品（涉嫌侵占部分業經檢察官不起訴處分確定），足以生損害於其臺灣銀行對於客戶資料管理之正確性、稅捐稽徵機關對於遺產稅稽徵之確保。自不能以本人名義為法律行為（最高法院87年度台上字第2341號民事判決意旨參照）。次按刑法之偽造文書罪，係以行為人無製作權而捏造他人名義製作文書。而不必確有損害之發生。刑法上處罰行使偽造私文書之主旨，重在保護文書之公共信用，故所偽造之文書既足以生損害於公眾或他人，其犯罪即應成立。要僅為犯罪動機之問題，並無影響於其行為該當刑法行使偽造私文書罪構成要件之認定（最高法院102年度台上字第4746號判決意旨參照）；又依遺產及贈與稅法第40條規定：「被繼承人死亡前在金融或信託機關租有保管箱或有存款者。猶未遵照繼承程序辦理，持如附表編號1、2所示用以表示被繼承人奚楊○授權辦理終止其生前保管箱租用契約之意旨之偽造「保管箱退租申請書」、「委託書」，交予不知情之臺灣銀行左營分行承辦人員吳秀○辦理前揭業務而行使。及其他遺產共同繼承人即奚○、奚○○、奚○江之權利，應構成偽造私文書之行為。四、核被告奚靜山所為，係犯刑法第216條、第210條行使偽造私文書罪嫌。被告與奚○怡間有犯意聯絡及行為分擔，應論以共同正犯。又被告分別於如附表編號1、2所示「保管箱退租申請書」、「委託書」偽造「楊○」署名、盜蓋「楊○」印文之行為，分屬偽造私文書之階段行為，偽造私文書後進而行使，偽造之低度行為，復為行使之高度行為所吸收，均不另論罪。又被告在先後偽造如附表編號1、2所示「保管箱退租申請書」、「委託書」並持以行使之行為，係於密切接近之時間及同地實施。竟未遵照繼承程序辦理，行使如附表編號1、2所示偽造之文書將奚楊○生前租用之保管箱退租，不僅損害臺灣銀行對於客戶資料管理之正確性、稅捐稽徵機關對於遺產稅稽徵之確保。並非基於蓄意、長期計畫之犯罪，告訴人奚○江告訴被告涉犯侵占部分犯行，業經檢察官為不起訴處分確定。以勵自新。七、被告與奚○怡共同冒用奚楊○名義，為停租奚楊○生前向臺灣銀行左營分行租用之保管箱，而分別於附表編號1、2所示「保管箱退租申請書」、「委託書」上偽簽「楊○」之署名各1枚，不問屬於犯人與否。又其上「楊○」印文各1枚，屬盜用真正印章而生，無庸宣告沒收。,0.17,0,偽造文書
