"謀議既定，張家銘即與張嘉讌共同基於意圖為自己不法所有之詐欺取財、行使偽造公文書及私文書等犯意聯絡，明知張家銘本人並未於華健資訊股份有限公司（下稱華健公司）任職，仍由張嘉讌以不詳方式取得偽造之華健公司出具之93年度各類所得扣繳暨免扣繳憑單（扣繳單位名稱：華健公司，所得人姓名：張家銘，所得所屬年月：93年1月至93年12月，給付淨額：287,600）1紙之私文書及偽造之財政部臺灣省北區國稅局（已改制為財政部北區國稅局）93年度綜合所得稅各類所得資料清單（所得人：張家銘，給付總額：287,600。在「消費性貸款」申請書上填寫任職於華健公司擔任技術人員及年收入36萬元等不實資料並簽名用印後，將該消費性貸款申請書連同上開偽造之93年度各類所得扣繳暨免扣繳憑單及財政部臺灣省北區國稅局93年度綜合所得稅各類所得資料清單等文件均交付予樹林農會獇寮分部不知情之承辦人員而行使之，以此詐術方式申辦貸款。並有證人即樹林農會總幹事周維賢、證人即樹林農會稽核股股長楊麗華於警詢時之證述在卷（參見96年度他字第825號影卷三第122至123頁、第124至126頁），復有樹林農會消費性貸款申請書、逾期放款催收記錄表、逾期放款暨催收款轉交呆帳查核表、偽造之93年度各類所得扣繳暨免扣繳憑單、財政部臺灣省北區國稅局93年度綜合所得稅各類所得資料清單、財政部財政資訊中心105年3月9日資理字第1050000674號函暨所附93年度所得清單、財政部北區國稅局105年3月23日北區國稅審二字第1050004714號函暨所附93年度綜合所得稅各類所得資料清單、新北市樹林區農會105年3月9日樹農信字第1052000269號函暨所附欠款明細表、臺灣高等法院102年度金上訴字第17、18、19、20、30號刑事判決各1份在卷可稽（參見本院卷八第159之1至159之7、本院卷三第9頁、第55頁、第90至92頁、第139頁、第144頁反面、第231頁反面至第232頁、本院卷二第90至132頁），足認被告自白與事實相符。比較時應就罪刑有關之共犯、未遂犯、想像競合犯、牽連犯、連續犯、結合犯，以及累犯加重、自首減輕暨其他法定加減（如身分加減）與加減例等一切情形，綜其全部罪刑之結果而為比較。經比較新舊法之結果，修正後刑法第339條規定並未更動詐欺取財罪之構成要件及得科處之法定刑種類，僅將得科或併科之罰金刑上限提高為50萬元。(二)核被告張家銘上開所為，係犯刑法第216條、第210條之行使偽造私文書罪、同法第216條、第211條之行使偽造公文書罪及修正前刑法第339條第1項之詐欺取財罪。公訴意旨於起訴書所犯法條欄雖疏未論以刑法第216條、第211條之行使偽造公文書罪，惟就被告此部分犯行已於犯罪事實欄中載述。應論以共同正犯。又被告係以一行為同時觸犯行使偽造私文書、行使偽造公文書及詐欺取財罪，為想像競合犯。竟仍聽從他人安排，並任由他人偽造相關貸款文件而持以行使，致使樹林農會誤信其有償債能力而核撥貸款。併此敘明。(四)至被告張家銘申請本件貸款所持以行使之前述偽造93年度各類所得扣繳暨免扣繳憑單、財政部臺灣省北區國稅局93年度綜合所得稅各類所得資料清單等文件，雖屬經偽造之文書，惟經被告張家銘提出於樹林農會申請貸款而交付。",0.5,0,偽造文書
為使巴福公司順利塗銷債權人SNCM公司第一順位抵押權，竟同時基於行使偽造公文書（行使下述偽造船舶登記證書）及詐欺取財（取得下述新船舶登記證書）與詐欺得利（塗銷債權人SNCM公司第一順位抵押權）之不法所有意圖，於103年4月3日以巴福公司名義函請航港局辦理塗銷「臺閩之星」抵押權設定。竟持不詳之人於不詳時間及地點，以影（列）印原始船舶登記證書製成並全紙護貝之偽造原船舶登記證書1份（下稱偽造船舶登記證書，另如附件所示）。利用邱信詰及其主管戴重仁（即航港局監理科科長）無法比對林姿儀所出示護貝之偽造船舶登記證書是否真正，另因偽造之船舶登記證書全紙護貝後，邱信詰無法於護貝之證書背面註記塗銷抵押權等文字，須由林姿儀另填船舶登記證書補換領申請書，並將偽造船舶登記證書繳回，而以申請換發新船舶登記證書之欺瞞方式，致使邱信詰誤信林姿儀行使提出之偽造船舶登記證書係屬真正，而於該證書之左上角剪角作廢收回。我只是一個送件的人，這張護貝證書不是我偽造的，當時做這件事的本意。不是我能控制的範圍，我不是故意要做這個犯行（指行使上揭偽造護貝版船舶登記證書），我判別不出真偽。本院卷第110-116頁邱信詰審判筆錄）、證人曾增富、陳和錦於調詢時（（見偵卷第21-24頁曾增富調查筆錄、第25-28頁陳和錦調查筆錄）、證人陳富美於調詢及本院審理時（見偵卷第33-35、46、47、51、52頁陳富美三次調查筆錄、本院卷第146-153頁陳富美審判筆錄）、證人周姵妏、王中平律師於本院審理時（見本院卷第116-119頁周姵妏審判筆錄、第153-157頁反面王中平律師審判筆錄）、證人即航港局北部航務中心監理科長戴重仁於本院審理時（見本院卷第158-163頁戴重仁審判筆錄）證述甚詳且互核相符；並有邱信詰所提被告行使之偽造船舶登記證書影本（見偵卷第20頁）、陳富美所提之巴福實業股份有限公司股票出賣附買回條件契約（含林姿儀、陳富美之中華民國國民身分證正反面影本）1份、本票影本5張（受款人陳富美，其中一張重覆）、陳富美匯款使用之玉山銀行交易明細表、林姿儀與陳富美簽立之還款協議書及公證書、陳富美委託黃梓微處理巴福公司債務之委託書、原船舶登記證書各1份（以上均為影本。隨於同月7日在航港局內以巴福公司代理人名義，持全紙護貝之偽造原船舶登記證書，向航港局承辦人員邱信詰辦理上開債權人SNCM公司之第一順位抵押權塗銷登記時，未告知邱信詰上揭原船舶登記證書已交由王中平律師保管，且因邱信詰無法於全紙護貝之偽造船舶登記證書背面註記塗銷抵押權等文字，而由被告另填船舶登記證書補換領申請書，並將偽造船舶登記證書繳回，而再申請換發新船舶登記證書，嗣邱信詰將被告行使提出之護貝版偽造船舶登記證書之左上角剪角作廢收回，另製作一份新船舶登記證書。除據證人邱信詰於調詢及本院審理時、證人周姵妏於本院審理中證述明確外（見上揭邱信詰、周姵妏筆錄），並有交通部航港局104年5月13日航北字第1040003131號函暨所附之「臺閩之星」案件清冊1份【含101年10月22日船舶所有權暫時保存登記申請書、船舶登記委託授權書、101年6月29日航北字第1013101530號函、船舶運送業臨時許可證、中華民國船舶國際噸位證書、中華民國臨時船舶國籍證書、巴福公司變更登記表、中國驗船中心臨時船級證書（包括查驗「臺閩之星」船舶等文件）、船舶抵押權設定登記申請書、船舶登記委託授權書、船舶登記簿、101年11月8日航北字第1010058278號函、巴福公司董事會議事錄暨變更登記表、臺灣基隆地方法院民事執行處101年12月21日基院義101司執溫字第29433號函暨船舶登記簿（債權人陳富美查封巴福公司「臺閩之星」部分）、臺灣基隆地方法院民事執行處102年5月7日基院義102司執溫字第943號函暨船舶登記簿（債權人陳奕民查封巴福公司「臺閩之星」部分）、臺灣基隆地方法院民事執行處102年7月11日基院義102司執助溫字第360號函暨船舶登記簿（債權人陳素芬查封巴福公司「臺閩之星」部分）、巴福公司103年4月3日巴實字第1030403-1號函交通部航港局暨所附辦理塗銷「臺閩之星」抵押權設定之船舶抵押（租賃）權註銷登記申請書、船舶登記證書換補領申請書、交通部航港局北部航務中心航政規費收據、船舶抵押（租賃）權註銷登記申請書（即公證人認證文件）、船舶登記證書補換領申請書、交通部航港局北部航務中心航政規費收據、債務清償證明書（SNCM公司出具、含代理人李志成律師身分證正反面影本）、船舶登記委託授權書（由巴福公司委託被告代理申請船舶抵押權及代領船舶所有權證書、含代理人被告身分證正反面影本）、宏聲海事商務法律事務所103年3月12日昇字第0003號函（聲請註銷「臺閩之星」抵押權註銷並呈報SNCM公司委任書及公司登記資料正本、承辦人李志成律師）、偽造船舶登記證書影本（邱信詰註記如有不實，申請人願負法律責任）、船舶登記證書影本（證書字號：北輪押字第000023號。是本件被告向航港局承辦人員邱信詰提出之護貝版船舶登記證書（即「甲證書」），顯係偽造之船舶登記證書無誤。⒊被告雖辯稱伊拿到護貝版船舶登記證書。明知真正之原船舶登記證書已交由王中平律師保管，仍持上揭護貝版之偽造船舶登記證書1份，向不知情之航港局承辦人員邱信詰辦理塗銷債權人SNCM公司之第一順位抵押權登記。再申請換發新船舶登記證書之欺瞞方式，致使邱信詰誤信上開偽造船舶登記證書係屬真正，將被告提出之護貝版偽造船舶登記證書之左上角剪角作廢收回。順利塗銷債權人SNCM公司第一順位船舶抵押權甚明。是被告辯稱伊不知拿到護貝版之船舶登記證書係他人偽造一節，顯不足採。且文書之內容係就公務員職務上之事項所製作，即令該偽造之公文書上所載製作名義機關不存在，或該文書所載之內容並非該管公務員職務上所管轄。仍難謂非公文書（最高法院54年度臺上字第1407號判例意旨參照）。又按將偽造證書複印或影印，與抄寫或打字不同。應認其為與原本作成名義人直接所表示意思之文書無異。自非不得為犯刑法上偽造證書罪之客體（最高法院75年台上字第5498號判例參照）。查本案被告交付航港局之護貝版偽造船舶登記證書，鑑定結果，雖係直接或間接影（列）印後再製而成，且該偽造證書上「（高速船）」字跡以及「交通部航港局」圓戳、「航港局（北）校對章」長戳、「黎瑞德」簽字章等均非直接書寫與蓋印，紙質螢光反應、複（列）印碳黑程度、印色反應均與交通部航港核發之真正證書不同。揆諸前揭說明，均屬偽造之公文書無誤。㈡核被告所為，係犯刑法第216條、第211條之行使偽造公文書罪、修正前刑法第339條第1項之詐欺取財罪及修正前刑法第339條第2項之詐欺得利罪。被告一行為觸犯上開3罪名。應依刑法第55條前段之規定，從一重之行使偽造公文書罪處斷。㈢累犯之適用：查被告前於95年間因詐欺、侵占案件，經臺灣嘉義地方法院以95年度訴字第386號判決分別判處有期徒刑3月、4月。再經臺灣高等法院臺南分院以98年度聲減字第107號裁定分別減為有期徒刑1月又15日、2月確定；又因侵占、偽造文書案件，經臺灣高等法院臺南分院以100年度重上更（二）字第138號判決判處有期徒刑4月減為有期徒刑2月（共3罪）、有期徒刑6月減為有期徒刑3月。5年以內故意再犯本件有期徒刑以上之罪，為累犯，應依法加重其刑。三、科刑：本院審酌被告有前偽造私文書等罪之前科紀錄，素行不佳。即應依現行即修正後刑法第五章之一規定處斷。經核本件如附件所示被告行使之偽造船舶登記證書，已交由航港局剪角作廢收回保管。無從宣告沒收，公訴意旨認此部分偽造船舶登記證書1份應予沒收，容有誤會。至如附件所示偽造船舶登記證書（左上角剪角作廢）正、反面之「交通部航港局圓戳」1枚、「黎瑞德」簽字章1枚及「航港局（北）校對章長戳」4枚均既係偽造之署名，依刑法第219條之規定。,1.83,0,偽造文書
意圖為自己不法之所有，共同基於行使偽造公文書、偽造私文書及詐欺取財之犯意聯絡，由該代辦業者於不詳時、地偽造如附表一所示財政部臺灣省北區國稅局民國93年度綜合所得稅各類所得資料清單之公文書（下稱各類所得清單）1紙，另偽刻如附表二所示「甲○○○○」公司印章及負責人「徐瑞鴻」印章各1枚，並持以蓋用於如附表二所示之甲○○○○在職證明書、薪資收據，而偽造該等私文書充作財力證明，乙○○並依代辦業者指示於貸款申請書上虛偽填載任職於甲○○○○、擔任外務人員、年收入新臺幣（下同）45萬元等不實資料，再由該代辦業者於94年12月28日，持如附表一、二所示偽造之公、私文書向臺北縣樹林市農會（現更名為新北市樹林區農會）獇寮分部（下稱樹林農會）審核貸款之承辦人行使，用以申請貸款，致該承辦人誤認乙○○資力及償還能力良好，因而陷於錯誤，准予貸款。貳、得心證之理由訊據被告於偵查中對於上開犯罪事實均坦承不諱（偵緝字第2262號卷第21、22頁），復有新北市樹林區農會105年8月16日樹農信字第1052001047號函暨附件臺北縣樹林市農會消費性貸款申請書、所偽造之如附表一、二所示之財政部臺灣省北區國稅局93年度綜合所得稅各類所得資料清單、上岩在職證明書、7至12月薪資收據等文件各1份、被告93年度電子閘門所得調件明細表、放款交易明細表各1份（偵緝字第2262號卷第35頁背面至36頁背面、本院卷第73至75、89至97、101頁），足認被告自白與事實相符。㈡又被告為上開犯行後，所涉刑法第339條第1項之詐欺取財罪部分，業於103年6月18日修正公布。法定刑就罰金刑部分提高為新臺幣（下同）50萬元，且增訂第339條之4：「犯第339條詐欺罪而有下列情形之一者，處1年以上7年以下有期徒刑，得併科100萬元以下罰金：一、冒用政府機關或公務員名義犯之。二、三人以上共同犯之。則非所問，其既冒用該機關名義作成，形式上足使人誤信為真正。㈡核被告所為，係犯刑法第216條、第210條之行使偽造私文書罪、第211條之行使偽造公文書罪及修正前刑法第339條第1項之詐欺取財罪。被告與姓名不詳之代辦業者間。此有本院、臺灣高等法院前開案號判決書1份在卷可佐。是自難認定王孟尉與被告間就本件行使偽造文書、詐欺犯行，有何犯意聯絡或行為分擔。應予更正。被告所共同偽造公文書之低度行為，為行使偽造公文書之高度行為所吸收，不另論罪；被告共同偽造如附表二所示「甲○○○○」及負責人「徐瑞鴻」之印章各1枚，復持以偽造印文，均為偽造私文書之階段行為，其偽造私文書之低度行為，則為其提出偽造私文書之行使高度行為所吸收，均不另論罪。被告基於使樹林農會核撥貸款之詐欺取財目的，以一行使偽造公文書、偽造私文書行為，作為實行詐術行為之一部。應依修正前刑法第55條前段規定，從一重論以行使偽造公文書罪處斷。三、撤銷原審判決之說明：原審認被告犯行明確。性質上屬公文書，原判決未論以行使偽造公文書罪，自有未洽。又被告與姓名年籍不詳之代辦業者偽刻如附表二所示「甲○○○○」及負責人「徐瑞鴻」之印章後，蓋於如附表二所示文書。原判決漏未審酌此部分，亦未宣告沒收上揭偽造之印章，亦有違誤。填載內容不實之申請書，與代辦業者共同持偽造之各類所得清單、在職證明書、薪資收據等文件，向樹林農會承辦人員行使。減其宣告刑2分之1。又被告本件行使偽造公文書罪法定刑為7年以下有期徒刑，故減刑後。特予敘明。六、沒收之說明：㈠附表一所示之偽造公文書，雖係供犯本案犯罪所用之物。自無從依刑法第38條第2項規定宣告沒收之。㈡被告所共同偽造如附表二所示文件，雖係供犯本案犯罪所用之物。故不併予宣告沒收，然附表二所示偽造之印章、印文均係被告所共同偽造，業據本院認定如前。㈢又本件貸款所得30萬元，固為被告共同犯詐欺取財罪所取得之貸款，然被告堅稱自身僅為出名之申辦貸款名義人。,0.5,0,偽造文書
二、高寰宇明知未得朱家瑩、洪榡吟之同意或授權，仍另基於行使偽造私文書及意圖為自己不法所有之詐欺犯意，於同年2月16日某時許。在附表各編號所示文件內，偽造「朱家瑩」、「洪榡吟」之簽名各5枚，表彰朱家瑩、洪榡吟本人同意以「限NP4G絕配1399限30手機案」之資費方案。以此方式，偽造如附表各編號所示之私文書各1紙，復連同上揭朱家瑩、洪榡吟遺失之國民身分證影本、全民健康保險卡影本。就事實欄二所為，係犯刑法第216條、第210條行使偽造私文書罪、刑法第339條第1項詐欺取財罪。被告所為如事實欄二所示偽造「朱家瑩」、「洪榡吟」之署名，係偽造各該私文書之階段行為，及偽造私文書後持以行使，其偽造之低度行為各為行使之高度行為所吸收，均不另論罪。被告同時、地持告訴人朱家瑩、洪榡吟之證件影本，偽簽告訴人朱家瑩、洪榡吟之署押並行使，係以一行為犯行使偽造私文書、詐欺取財，為想像競合犯，應依刑法第55條規定，從一重之行使偽造私文書罪論處。至被告所犯上揭侵占遺失物罪、行使偽造私文書罪，犯意各別。以資懲儆。五、沒收：㈠如附表各編號所示文件偽造之「朱家瑩」、「洪榡吟」署押各5枚，不問屬於被告與否，均應依刑法第219條規定諭知沒收。至如附表各編號所示偽造之文件，係被告交付予永沛企業社、遠傳電信股份有限公司行使以申請行動電話門號。附此敘明。末按所謂「偽造之署押」，係指行為人冒用本人名義在文件上簽名或為民法第3條第3項所稱指印之類似簽名之行為者而言，如果僅在文書之姓名欄。,0.25,0,偽造文書
竟逾越授權範圍，擅為下列行為：㈠蔡秉澄基於冒用身分、行使偽造私文書及意圖為自己不法所有之詐欺犯意，於104年9月20日某時許。出示林逸竣之國民身分證、全民健康保險卡影像資料，冒用其身分，申辦行動電話門號。仍委由不知情之副店長簡子原在附表編號1所示亞太電信股份有限公司3G預付卡申請書上申請人簽章攔內，偽造「林逸竣」之署名1枚，表彰林逸竣本人同意依其資費方案申辦行動電話門號之旨，以此方式，偽造亞太電信股份有限公司3G預付卡申請書之私文書1紙，足生損害於林逸竣本人及亞太電信股份有限公司稽核行動電話申請用戶之正確性。而為行使，致簡子原陷於錯誤，交付門號0000000000號通話晶片卡1枚。㈡蔡秉澄基於冒用身分、行使偽造私文書及意圖為自己不法所有、不法利益之詐欺犯意，於104年9月22日某時許。出示林逸竣之國民身分證、全民健康保險卡影像資料，冒用其身分，明知未經林逸竣同意或授權，仍自行或委由不知情之簡子原在附表編號2所示文書各該欄位偽造「林逸竣」之署名共7枚，表彰林逸竣本人同意以「SD早鳥案（30）_0000000版（含NP免預繳）」資費方案。以此方式，偽造附表編號2所示私文書各1紙，足生損害於林逸竣本人及台灣大哥大股份有限公司稽核行動電話申請用戶之正確性。而為行使，致簡子原陷於錯誤，交付門號0000000000號通話晶片卡1枚及行動電話1具。取得使用通訊服務之利益。㈢蔡秉澄基於冒用身分、行使偽造私文書及意圖為自己不法所有、不法利益之詐欺犯意，於104年9月24日某時許。出示林逸竣之國民身分證、全民健康保險卡影像資料，冒用其身分，明知未經林逸竣同意或授權，仍委由不知情之簡子原，在附表編號3所示文書各該欄位偽造「林逸竣」之署名共5枚，表彰林逸竣本人同意以「有錢卡-限NP4G新絕配1399限30手機案」資費方案。以此方式，偽造附表編號3所示私文書各1紙，足生損害於林逸竣本人及遠傳電信股份有限公司稽核行動電話申請用戶之正確性。而為行使，致簡子原陷於錯誤，交付門號0000000000號通話晶片卡1枚及行動電話1具。二、論罪科刑：㈠核被告就事實欄一㈠所為，係犯戶籍法第75條第3項冒用身分使用他人交付之國民身分證罪、刑法第216條、第210條行使偽造私文書罪、刑法第339條第1項詐欺取財罪；事實欄一㈡所為，係犯戶籍法第75條第3項冒用身分使用他人交付之國民身分證罪、刑法第216條、第210條行使偽造私文書罪、刑法第339條第1項詐欺取財罪、同條第2項詐欺得利罪；事實欄一㈢所為，係犯戶籍法第75條第3項冒用身分使用他人交付之國民身分證罪、刑法第216條、第210條行使偽造私文書罪、刑法第339條第1項詐欺取財罪、同條第2項詐欺得利罪。㈡被告委由不知情之簡子原偽造林逸竣署名以偽造私文書，為間接正犯。㈢被告偽造「林逸竣」署名，係偽造各該私文書之階段行為，及偽造私文書後持以行使，其偽造之低度行為各為行使之高度行為所吸收，均不另論罪。應依刑法第55條規定，分別從一重之行使偽造私文書罪論處。至被告所犯三行使偽造私文書罪，犯意各別。自食其力，竟冒用告訴人名義申辦門號取得行動電話，供己通訊使用。應逕適用裁判時之刑法規定。附表所示文書上偽造之「林逸竣」署名，為偽造之署押，不問屬於犯人與否，應依刑法第219條規定，於被告所犯各該行使偽造私文書罪之主文項下宣告沒收。被告於104年9月22日、104年9月24日詐得之行動電話各1具。追徵其價額。至被告冒用身分申辦行動電話門號持以通訊使用所得不法利益，涉及資費方案之計算。,0.58,0,偽造文書
事實一、蔡三玄於民國104年9月18日晚間9時30分許，在新北市○○區○○路000巷00號因涉嫌施用第三級毒品為警盤查，自認其本人已受通緝，為規避刑責，竟基於行使偽造私文書之犯意，冒用楊子明名義接受調查，而接續在附表編號1至4所示各項文件上，偽造「楊子明」之署名及指印，且將其中編號1足以表示楊子明本人願接受員警對其身體及隨身攜帶物件實施搜索之特定意思表示，而為偽造之私文書交付承辦警員行使之，足生損害於楊子明及司法機關對於犯罪偵查之正確性。在新北市○○區○○路000巷00號5樓遇警持搜索票執行搜索，復基於行使偽造私文書之犯意，冒用楊子明名義接受調查，而接續在附表編號5至11所示各項文件上偽造「楊子明」之署名及指印，且將其中編號8、9足以表示楊子明本人同意無庸將受逮捕事實通知親友，及同意接受員警採集尿液之特定意思表示，而為偽造之私文書交付承辦警員行使之，足生損害於楊子明及司法機關對於犯罪偵查之正確性。應依法論科。二、論罪科刑：㈠被告於附表編號1、8、9所示「自願搜索同意書」、「執行逮捕、拘禁告知親友通知書」、「勘查採證同意書」上偽造「楊子明」之署押，依其內容形式觀察。自不具刑法私文書之性質，是此部分應僅該當偽造署押。㈡核被告所為，係犯刑法第216條、第210條之行使偽造私文書罪（共二罪）。被告於104年9月18、19日在附表編號1至4所示文件，及於104年10月22日在附表編號5至11所示文件上偽造署押之行為，各係基於同一規避查緝之目的。各為「接續犯」。被告偽造署押之行為，為偽造私文書之階段行為，又偽造私文書後持以行使，其偽造之低度行為應為行使之高度行為所吸收，均不另論罪。㈢被告所犯二行使偽造私文書罪，犯意各別。其於徒刑執行完畢後5年內故意再犯上開有期徒刑以上之罪，為累犯，應依刑法第47條第1項規定，加重其刑。㈤爰審酌被告為求掩飾身分規避刑責，竟以他人名義接受調查，並偽造署押，非僅使楊子明無端受犯罪偵查。應逕適用裁判時之刑法規定。附表編號1至4、5至11所示各項文件上偽造之「楊子明」簽名、指印，為偽造之署押，不問屬於犯人與否。,0.58,0,偽造文書
